3,afaslive,55,0,2021-12-06 10:01:46,"I’m an Englishman in New York, uh Amsterdam! Want op 25 maart staat niemand minder dan @theofficialsting in #AFASLive! 😍

De show genaamd “My Songs” zit vol met nummers uit de glansrijke carrière die Sting zowel solo als met The Police schreef. Het concert neemt het publiek mee op een muzikale reis door de tijd, en fans natuurlijk kunnen rekenen op de bekende hits “Every Breath You Take”, “Message In A Bottle”, en natuurlijk “Englishman In New York”. 🎶 ⭐

De kaartverkoop voor deze show start a.s. vrijdag 10 december om 10:00 uur via Ticketmaster. Alle info vind je op onze website!",2021-03-25 10:00:00
4,afaslive,287,9,2021-12-03 10:01:19,"🎶🕺Alors on danse, want op zondag 27 februari staat niemand minder dan @Stromae in #AFASLive!

10 jaar geleden brak Stromae door met zijn unieke mix van elektronische beats met hiphop en Frans chanson met als resultaat enorme hits als “Papaoutai” en “Formidable”, en na meer dan 6 jaar keert hij terug op het podium. 😍
 
De kaartverkoop voor deze show begint vanavond om 18:00 uur, ga jij een ticket scoren? Meer info vind je op onze website!",2021-02-27 18:00:00
5,afaslive,128,7,2021-11-15 16:01:21,"#ATINY opgelet! 🚨 Eindelijk mogen we aankondigen dat de immens populaire K-pop groep #ATEEZ op 13 februari bij ons op het podium staat 😍

De sensationele groep brengt hun THE FELLOWSHIP: BEGINNING OF THE END WORLD TOUR na bijna 2 jaar uitgesteld te zijn naar Amsterdam.

Kaartkopers krijgen een mail van Ticketmaster met de belangrijkste info. Vanaf donderdag 15:00 uur zal er nog een aantal tickets beschikbaar komen. Check onze website voor verdere info!",2021-02-13 15:00:00
6,afaslive,19,0,2021-11-12 10:30:12,"Ticketalert! 🚨 Zometeen om 11:00 uur begint de kaartverkoop voor het concert van de Australische band @parkwaydriveofficial! Op 23 september zullen zij samen met Special Guest @whileshesleeps in AFAS Live staan 🤩

Kijk voor alle info en tickets op https://www.afaslive.nl/agenda/parkway-drive",2021-09-23 11:00:00
7,afaslive,31,0,2021-11-12 09:30:46,"Do you want to buy a ticket? Zorg dan dat je klaar zit want straks om 10:00 uur begint de kaartverkoop voor de show van @franz_ferdinand! 🤩 De Schotse rockband staat volgend jaar op 15 april bij ons op het podium, zien we jou daar? 🔥

Info en tickets > https://www.afaslive.nl/agenda/franz-ferdinand",2021-04-15 10:00:00
8,afaslive,37,0,2021-11-10 11:05:28,"Viva the Underdogs! Op vrijdag 23 september staat de Australische band @parkwaydriveofficial  in #AFASLive! 🔥 De band is de laatste 15 jaar langzaam maar zeker uitgegroeid tot een grote naam in het genre. Hun vijf eerste albums behaalden allemaal de gouden status in thuisland Australië. Met de release van Reverence (2018) werd de weg naar het grote internationale succes ingezet. 
De special guest van deze show is de Britse band #WhileSheSleeps. De kaartverkoop voor deze show start a.s. vrijdag 12 november om 11:00 uur via Ticketmaster. Check alle info op onze website!",2021-09-23 11:00:00
9,afaslive,39,3,2021-11-09 17:01:08,"Op 12 april 2022 staat #Khruangbin in #AFASLive! ✈️

De psychedelische funksensatie komt uit Texas, waar de drummer Donald Johnson en gitarist Mark Speer speelden in de huisband van een kerk, en frontvrouw Laura Lee maakte het trio compleet. Khruangbin vond zijn unieke geluid door genres van overal ter wereld: van Thaise funk tot Spaanse en Midden-Oosterse muziek, samen te brengen in kalmerende composities vol meeslepende melodieën. ✨

De kaartverkoop voor deze show begint deze vrijdag om 10:00 uur. Kijk voor alle informatie over dit concert op onze website!",2021-04-12 10:00:00
10,afaslive,36,3,2021-11-07 18:51:35,"@freekvonk kondigt vandaag show 10 aan in #AFASLive!! Deze tiende show is op 27 december om 17:00 uur. Ben jij erbij deze kerstvakantie? 🦎🐊🦂🐅🦇🐢🦈🐋🐘🪲🐜🐡🐳 
Ga voor meer info naar www.afaslive.nl",2021-12-27 17:00:00
11,afaslive,50,4,2021-11-05 11:05:44,"I say, take me out! 🤟De Schotse rockband Franz Ferdinand komt op vrijdag 15 april 2022 naar AFAS Live!  Het concert is onderdeel van de ""Hits To The Head"" tour, gelijknamig aan het best-of album dat binnenkort uitkomt.🤩 De kaartverkoop voor deze show start vrijdag 12 november om 10:00 via www.afaslive.nl!",2021-04-15 10:00:00
12,afaslive,20,0,2021-10-29 09:00:14,"🚨 Fans van #ConanGray opgelet: de kaartverkoop voor het concert van de Amerikaanse popster begint straks om 10:00 uur! 💖 Dus pak je laptop, zet z'n nieuwste nummer ""Telepath"" aan, en scoor die tickets 🎟

Kaartjes voor de show op vrijdag 27 mei vind je via onze website!",2021-05-27 10:00:00
13,afaslive,40,0,2021-10-26 19:32:49,"“Ik heb die bon gepakt maar ook een ton gepakt” 🎶 Op 30 april 2022 staat “de mannelijke Gwen Stefani” #Donnie in #AFASLive! 🔥

Na al meerdere albums uitgebracht te hebben ging zijn track “Snelle Planga” in 2018 helemaal viraal, waarmee de rapper bewees een meester te zijn in het creëren van hypes. 😎 Daarna bracht hij in 20-19 zijn album “Door het Licht” uit met de tracks “Barry Haze” en “Kwijt”. Het grote publiek leerde hem daarnaast kennen door zijn hits met Frans Bauer (Geen Centen, Maar Spullen), Frans Duijts (Frans Duits / De Leeuwendans), Gerard Joling (Dit Is De Tijd) en René Froger (Bon Gepakt).

De kaartverkoop voor deze show start a.s. donderdag 28 oktober om 10:00 via Ticketmaster. Check alle info op onze website!",2021-04-30 10:00:00
14,afaslive,62,2,2021-10-25 18:01:17,'YOU MANIAC'🎶 Popster @conangray komt op 27 mei naar #AFASLive met zijn 'The Conan Gray World Tour 2022'. Aanstaande vrijdag deelt Conan zijn nieuwe single Telepath. Ondertussen is Conan's meest recente single People Watching tot nu toe bijna 85 miljoen keer gestreamd! De kaartverkoop voor zijn show start vrijdag 29 oktober om 10:00 uur. Meer info via www.afaslive.nl,2021-05-27 10:00:00
15,afaslive,17,0,2021-10-20 17:10:02,"Eindelijk gaat het gebeuren: #ClubAvondklokXXL in #AFASLive!🔥

Het afgelopen voorjaar zorgde #DéfanoHolwijn met zijn FC Avondklok sessies via zijn Instagram account voor ruim 500.000 kijkers. Met entertainment voor jong en oud wist hij veel mensen in de soms moeilijke tijden van lockdown en avondklok te vermaken.

Op 27 november staat Defano samen met onder andere #JayhJawson en #LaRouge op ons podium! De kaartverkoop is al gestart, kijk voor alle info op onze website!",2021-11-27 00:00:00
16,afaslive,15,0,2021-10-15 09:30:39,"Zometeen om 10:00 uur begint de kaartverkoop voor de show van #Bonobo!🔥 De Britse dj/producer staat op 20 april 2022 op het podium in #AFASLive met zijn nieuwe album ""Fragments"" op zak.🤩

Check voor alle info en tickets onze website!",2021-04-20 10:00:00
17,afaslive,33,2,2021-10-10 11:22:11,"@sunneryjamesryanmarciano komen met hun show Sexy By Nature op 11 december 2021 naar #AFASLive!
De kaartverkoop voor deze show start 22 oktober om 10:00 uur. 
Meer info via www.afaslive.nl",2021-12-11 10:00:00
18,afaslive,30,0,2021-10-06 18:21:11,"Op 20 april staat de Britse dj/producer #Bonobo in #AFASLive! 🤩

De show is onderdeel van de “Fragments Live Tour” dat in het teken staat van het gelijknamige nieuwe album wat begin volgend jaar uitkomt. 😍
Volgens Bonobo is zijn nieuwe album de meest emotioneel intense plaat die hij tot nu toe heeft gemaakt. ✨

De kaartverkoop voor deze show begint vrijdag 15 oktober om 10:00 uur via Ticketmaster. Meer info vind je op onze website.",2021-04-20 10:00:00
19,afaslive,21,1,2021-10-02 11:00:34,"Strakjes om 12:00 uur begint de kaartverkoop voor Peacock in Concert! 🔥 

𝘛𝘪𝘮𝘦 𝘪𝘴 𝘢𝘯 𝘪𝘭𝘭𝘶𝘴𝘪𝘰𝘯: 𝘰𝘶𝘳 𝘱𝘦𝘳𝘤𝘦𝘱𝘵𝘪𝘰𝘯 𝘰𝘧 𝘪𝘵𝘴 𝘧𝘭𝘰𝘸 𝘥𝘰𝘦𝘴𝘯’𝘵 𝘮𝘢𝘵𝘤𝘩 𝘵𝘩𝘦 𝘱𝘩𝘺𝘴𝘪𝘤𝘢𝘭 𝘳𝘦𝘢𝘭𝘪𝘵𝘺 𝘸𝘦 𝘦𝘹𝘱𝘦𝘳𝘪𝘦𝘯𝘤𝘦. 𝘞𝘩𝘦𝘯 𝘵𝘪𝘮𝘦 𝘦𝘮𝘦𝘳𝘨𝘦𝘴, 𝘣𝘰𝘵𝘩 𝘪𝘭𝘭𝘶𝘴𝘪𝘰𝘯𝘴 𝘢𝘯𝘥 𝘵𝘩𝘦 𝘳𝘦𝘱𝘳𝘦𝘴𝘦𝘯𝘵𝘢𝘵𝘪𝘰𝘯 𝘰𝘧 𝘩𝘶𝘮𝘢𝘯𝘴’ 𝘪𝘯𝘢𝘣𝘪𝘭𝘪𝘵𝘺 𝘵𝘰 𝘴𝘦𝘦 𝘵𝘩𝘦 𝘸𝘰𝘳𝘭𝘥 𝘪𝘯 𝘢𝘭𝘭 𝘰𝘧 𝘪𝘵𝘴 𝘥𝘦𝘵𝘢𝘪𝘭𝘴 𝘢𝘳𝘪𝘴𝘦. 𝘉𝘶𝘵 𝘸𝘩𝘢𝘵 𝘪𝘴 𝘳𝘦𝘢𝘭𝘪𝘵𝘺 𝘵𝘩𝘦𝘯, 𝘪𝘧 𝘵𝘩𝘦𝘳𝘦 𝘦𝘷𝘦𝘯 𝘪𝘴 𝘰𝘯𝘦 𝘵𝘰 𝘣𝘦 𝘥𝘦𝘧𝘪𝘯𝘦𝘥?

Ben jij erbij 20 november in #AFASLive? 🤩
Tickets scoor je via onze website!",2021-11-20 12:00:00
20,afaslive,41,0,2021-10-01 15:07:31,"Op 13 oktober worden tijdens het #AmsterdamDanceEvent de Top100 DJs Awards uitgereikt! 🔥 
Op de line-up voor deze avond staan onder andere #Afrojack, #DonDiablo en #ArminvanBuuren, en er worden volgende week nog meer namen bekend gemaakt! 🤩
Tickets zijn vanaf maandag 4 oktober 16:00 uur verkrijgbaar. Check voor info onze website!",2021-10-13 16:00:00
21,afaslive,12,0,2021-10-01 09:45:40,"It's time to lighten up jullie schermen, want de kaartverkoop voor de show van #Parcels begint zometeen om 10:00 uur! 💻💡
De Australische electropopband geeft op 24 september 2022 een concert in #AFASLive. Het is nog even (ahum) wachten, maar dat wordt het waard! 🤩
Tickets vind je op onze website.",2021-09-24 10:00:00
22,afaslive,28,0,2021-09-30 11:44:29,"Zometeen om 12:00 uur begint de kaartverkoop voor de ADE special van #AStateOfTrance! 🤩 De show vindt plaats op 14 oktober van 19:00 tot 23:59, en belooft een spektakel te worden🔥🔥🔥

Tickets vind je via onze website!",2021-10-14 12:00:00
23,afaslive,80,10,2021-09-29 10:21:45,Op 20 november van 16:00 tot 00:00 nodigen Peacock in Concert & BKJN je uit voor een deep dive door de ''Illusion of Time''!🔥 Maak je klaar voor een muzikaal en visueel spektakel in AFAS Live! ⏰ De kaartverkoop voor dit evenement start op 2 oktober om 12:00! Zorg dat je er bij bent!,2021-11-20 16:00:00
24,afaslive,34,0,2021-09-28 10:16:16,"Tieduprightnow!✨ De Australische electropopband @parcelsmusic geeft op zaterdag 24 september 2022 een concert in #AFASLive. De aankondiging komt voorafgaand aan de release van hun tweede album 'Day/Night', dat op 5 november uitkomt. 

Met hits als 'Tieduprightnow', 'Overnight' en de meest recente single 'Somethinggreater' weet Parcels hun fanschare keer op keer groter te maken. Op het nog uit te komen nieuwe album 'Day/Night' bevindt Parcels zich muzikaal op nieuw terrein.

De kaartverkoop voor dit concert start op vrijdag 1 oktober om 10:00 uur. Check voor meer info www.afaslive.nl",2021-09-24 10:00:00
25,afaslive,708,77,2021-09-27 17:02:28,"E buonasera signore e signori 🎶 Op 3 maart 2022 staat #Måneskin in #AFASLive! 😍 De Italiaanse rockers wonnen het afgelopen voorjaar het Eurovisie Songfestival in Rotterdam, en sindsdien bestormd de band hitlijsten. Sinds de release van hun laatste album hebben ze in maar liefst vijftien verschillende landen diverse platina en gouden platen 🔥🔥🔥

De kaartverkoop voor dit concert begint a.s. donderdag 30 september om 12:00. Alle info en laatste updates vind je op onze website.",2021-09-30 12:00:00
26,afaslive,14,0,2021-09-22 17:34:17,"LIVE FOR THIS IS BACK! 🔥
Op zaterdag 13 november komt #Warface terug naar #AFASLive met een nieuwe editie van zijn show #LiveForThis 😎
De kaartverkoop voor deze show start op 28 september om 19:00 uur, zorg dat je er snel bij bent! Houd onze website in de gaten voor alle info en de laatste updates.",2021-11-13 19:00:00
27,afaslive,16,0,2021-09-15 12:00:51,"HOLY MOLY! De kaarten voor de shows van je favoriete bioloog Prof. dr. #FreekVonk gaan zó hard, dat er een 9e(!) show is toegevoegd in de kerstvakantie!🔥 Tickets voor de show op 30 december om 17:00 uur gaan vandaag vanaf 15:00 uur in de verkoop, zorg dat je er als een cheetah bij bent🐆
Kijk op onze website voor alle data, tickets en meer info!",2021-12-30 17:00:00
28,afaslive,29,0,2021-08-31 10:07:00,"@dreamtheaterofficial geeft op vrijdag 13 mei 2022 een concert in #AFASLive in het kader van Top Of The World Tour! 🤘

Een hoogstaande mix van progrock, heavy metal en symfonische rock. De band verkocht meer dan tien miljoen albums en nog steeds zijn gitarist John Petrucci en de mannen hongerig. Natuurlijk is dat ook on stage te merken; hun live-reputatie is haast legendarisch. Verwacht tijdens de show veel nieuwe nummers van het nog te verschijnen album A View From The Top Of The World.

De kaartverkoop start aanstaande vrijdag om 10.00u. Meer info via www.afaslive.nl",2021-05-13 10:00:00
29,afaslive,93,2,2021-08-20 14:02:13,"Loop morgen, 21 augustus, mee met Unmute Us: de vreedzame protestmars voor de evenementenbranche. De start is om 14.00u op onderstaande locaties.
Amsterdam - RAI
Eindhoven - Ketelhuisplein
Groningen - Concourslaan
Nijmegen - Waalkade
Rotterdam - Wilhelminakade
Utrecht - Lepelenburg

Hiermee vraagt de sector om een duidelijk toekomstplan, met meetbare afspraken, maar ook om erkenning voor de emotionele gesteldheid van de vele bezoekers en makers die zich niet gehoord voelen. We willen elkaar weer kunnen ontmoeten, weer kunnen lachen en dansen. Bovenal willen we weer vooruit kunnen kijken.

Kijk op www.unmute-us.nl voor meer informatie.

#unmuteus #AFASLive",2021-08-21 14:00:00
30,afaslive,93,3,2021-07-14 15:36:58,"Who, wat gaan de tickets voor @freekvonk hard! Daarom is er een 7de show bijgekomen, op 30 december om 10:00 uur. Ben jij erbij?? 🐍🐢🦅🐒🐸🦁🦍🦈🐆🦛🐃 Check www.afaslive.nl voor tickets",2021-12-30 10:00:00
31,afaslive,35,1,2021-07-13 16:39:38,"Op zaterdag 16 oktober komt de Berlijnse DJ en producer #PaulKalkbrenner met zijn Episode One concertreeks naar #AFASLive tijdens het Amsterdam Dance Event. De kaartverkoop start maandag 19 juli om 10:00 uur. 

Tijdens Amsterdam Dance Event wordt AFAS Live tijdelijk omgetoverd tot een broeierige Berlijnse bunker. Denk: donker, eindeloze nachten en de magie van diepe, spannende techno. Als koning van de sfeervolle techno heeft Paul Kalkbrenner alles in huis om je mee te nemen naar zijn Berlijn.

Meer info via www.afaslive.nl",2021-10-16 10:00:00
32,afaslive,33,2,2021-07-12 10:11:10,"@jamestaylor_com geeft op zaterdag 22 januari samen met zijn All-Star Band een concert in #AFASLive. De kaartverkoop start vrijdag 16 juli om 10.00 uur.

James Taylor is één van de belangrijkste en bekendste singer-songwriters allertijden. Gezegend met zijn herkenbare, warme baritonstem en uniek gitaarspel speelt hij al decennia lang voor zijn trouwe fans. Miljoenen verkochte platen zoals ‘Sweet Baby James’, ‘October Road’ en meerdere gewonnen Grammy Awards zorgden voor hoge pieken in zijn carrière. In januari staat hij samen met zijn All-Star band in AFAS Live voor een concert.

Meer info via www.afaslive.nl",2021-01-22 10:00:00
33,afaslive,24,0,2021-06-24 20:00:11,A.s. maandag gaan de tickets voor de mysterieuze man met het gouden masker in de verkoop: Claptone! Masquerade komt naar #AFASLive op vrijdag 15 oktober 2021. Speciaal voor #ADE zal Claptone een aantal bijzondere muzikale vrienden uitnodigen. De ticketverkoop start op maandag 28 juni om 12:00 uur. Meer info via www.afaslive.nl,2021-10-15 12:00:00
34,afaslive,65,7,2021-06-22 09:35:05,"@lordemusic komt naar #AFASLive!☀️ Op 8 juni staat de Nieuw-Zeelandse popzangeres in onze zaal. De kaartverkoop start aanstaande vrijdag om 10.00 uur. Meer info via www.afaslive.nl

Vanuit het niets bestormt de Nieuw-Zeelandse Lorde in 2013 de hitlijsten wereldwijd met single 'Royals' die haar twee Grammy's oplevert. Al snel volgt debuutalbum 'Pure Heroine' dat - net zoals tweede plaat 'Melodrama' - vol staat met dromerige indietronica en indringende popnummers. Met haar uitgesproken teksten wordt ze al snel bestempeld als dé stem van de nieuwe generatie. Na een afwezigheid van vier jaar verscheen onlangs haar nieuwe single 'Solar Power', die afkomstig is van het gelijknamige, derde studioalbum dat op 20 augustus uitkomt.",2021-08-20 10:00:00
35,afaslive,84,4,2021-06-21 10:15:56,"And way down we go🔥 De IJslandse rockband #KALEO geeft op vrijdag 21 januari 2022 een concert in #AFASLive. Het concert is onderdeel van de Fight or Flight Tour. De kaartverkoop start vrijdag 25 juni om 10.00 uur. Meer info via www.afaslive.nl

Sinds de release van hun goud-gecertificeerde doorbraakalbum A/B uit 2016, geniet KALEO wereldwijde bekendheid met hun alternatieve rock sound. Het album bracht meerdere hitsingles voort: het GRAMMY-genomineerde No Good en het goudverkopende All The Pretty Girls. Het tweemaal Platinum-gecertificeerde nummer Way Down We Go werd gebruikt in diverse populaire televisieseries zoals Grey's Anatomy en Riverdale.",2021-01-21 10:00:00
36,afaslive,75,1,2021-06-14 17:01:57,De Britse band #TheKooks viert het 15-jarig jubileum van hun debuutalbum ‘Inside In / Inside Out’ met een uitgebreide tournee die de band op 5 maart naar #AFASLive  brengt. De voorverkoop voor dit concert start op vrijdag 18 juni om 10:00 uur. Meer info via www.afaslive.nl,2021-06-18 10:00:00
37,afaslive,134,1,2021-06-09 14:33:34,#Cho komt naar #AFASLive!🔥 Vanwege de enorme vraag naar tickets zijn de twee concerten die @cho_nwa in Paradiso zou geven samengevoegd en verplaatst naar AFAS Live op zaterdag 2 oktober 2021. De reguliere kaartverkoop voor AFAS Live start vrijdag 11 juni om 10:00 uur. Meer info via www.afaslive.nl,2021-06-11 10:00:00
38,afaslive,50,3,2021-06-08 20:00:22,#RoyalBlood komt op woensdag 23 maart 2022 naar #AFASLive! Kaartverkoop start vrijdag 11 juni om 10.00 uur. Meer info via www.afaslive.nl,2021-03-23 10:00:00
39,afaslive,62,0,2021-06-07 10:12:00,'I hear trouble coming'🎶 Op woensdag 23 maart 2022 komt het Britse rock-duo @royalblooduk naar #AFASLive! Het concert is onderdeel van de grootste Europese headline tour van Royal Blood tot nu toe. Het voorprogramma wordt verzorgd door special guests @theamazons. Kaartverkoop start vrijdag 11 juni om 10.00 uur. Check meer info via www.afaslive.nl,2021-03-23 10:00:00
40,afaslive,34,1,2021-06-02 17:02:07,"Op vrijdag 17 december 2021 geeft @feestdjruud een show in de #AFASLive: 'Lonely At The Tap'🎉 Het belooft het eerste grote feest van het najaar te worden als het weer kan, zonder beperkende maatregelen.

Met confetti, bitterballen en een speciale Lonely At The Tap-sjaal is #FeestDJRuud er klaar voor om samen met jou het einde van de lockdown met een slockdown te vieren!

Kaartverkoop start aanstaande vrijdag 04 juni om 10:00 uur. Meer info via www.afaslive.nl",2021-12-17 10:00:00
41,afaslive,21,0,2021-05-26 14:40:34,De eerste twee shows van @freekvonk in #AFASLive zijn al helemaal uitverkocht. Vandaag is er een zesde show bijgekomen: 29 december om 13:30 uur. Wie zien we dan?,2021-12-29 13:30:00
42,afaslive,26,0,2021-05-20 11:32:08,"Vanwege de coronamaatregelen, is het concert van @rolfsanchez dat gepland stond op 11 juni 2021 (oorspronkelijke datum 10 april 2020) in #AFASLive opnieuw verplaatst naar 3 december 2021. 

Kaartkopers ontvangen een email met meer informatie. Op 27 mei om 10:00 uur komen de laatste kaarten in de verkoop. Meer info via www.afaslive.nl",2021-06-11 10:00:00
43,afaslive,70,5,2021-05-20 10:01:36,"The Lumineers komen op zondag 20 februari naar #AFASLive!✨ Ter ere van de nieuw bevestigde Europe 2022 tour bracht de band gisteren een 4-track live EP ‘Live from the Last Night of Tour’ uit.

Het titelloze debuutalbum van @thelumineers werd in 2012, mede dankzij de monsterhit ‘Ho Hey’ 3 x platina in de US. Opvolger Cleopatra werd in 2016 de band’s 2e #1 album in de US Billboard Charts in 2019 gevolgd door het introspectieve en overrompelende ‘III’. 

Kaartverkoop start op donderdag 27 mei om 10.00 uur. Meer info via www.afaslive.nl",2021-02-20 10:00:00
44,afaslive,40,0,2021-05-17 14:37:34,"Samen vieren we het leven op de dag dat het weer mag tijdens #CelebrateLife: het eerste grote feest zonder beperkingen🎉🎉 Zodra de coronamaatregelen het toelaten zien we jou vooraan in #AFASLive met: @dejeugd, @maan.de.st, @ronnieflex en @vunzigedeuntjes.

Pre-registratie voor de eerste tickets nu mogelijk via wecelebratelife.nl. De pre- registratieverkoop start dinsdag 25 mei om 10.00.",2021-05-25 10:00:00
45,afaslive,29,1,2021-05-11 12:45:04,"Na ruim een jaar zonder de energie van volle zalen, samen dansen en meezingen met je favoriete artiesten, komt het podium eindelijk weer in zicht. #Heineken®, @official_idt en @mojoconcerts bundelen alle krachten om ‘op de dag dat het weer mag’ het eerste grootschalige evenement zonder beperkingen te organiseren: Celebrate Life, in #ZiggoDome en #AFASLive. Zodra de coronamaatregelen het toelaten, staan we weer schouder aan schouder. Het is tijd om samen het leven te vieren.

Ticketverkoop start op woensdag 26 mei 10:00 uur via www.wecelebratelife.nl

Op de dag dat het weer mag:
CELEBRATE LIFE – DE DAG DAT HET WEER MAG
AFAS Live, Amsterdam
met: De Jeugd Van Tegenwoordig, MAAN, Ronnie Flex & The Fam en Vunzige Deuntjes Soundsystem",2021-05-26 10:00:00
46,afaslive,23,1,2021-05-03 10:50:07,"De tickets voor de shows van @freekvonk in #AFASLive gaan zo hard dat er een 4E SHOW bij komt! In de kerstvakantie op 29 december 2021 om 10:00 uur 🐍🐢🦅🐒🐸🦁🦍🦈🐆🦛🐃

Check: www.afaslive.nl",2021-12-29 10:00:00
47,afaslive,39,1,2021-04-26 11:26:22,"@rupaulsdragrace voegt een extra show toe aan de Werq The World Tour! Deze vindt plaats op 17 mei 2022 in #AFASLive. De kaartverkoop start aanstaande donderdag 29 april om 11:00 uur. Meer info via www.afaslive.nl

Bij een experiment dat helemaal fout gaat, raakt Michelle Visage verdwaald in de tijd, zonder mogelijkheid terug naar huis te keren. Ga samen met Asia O’Hara, Gottmik, Jaida Essence Hall, Plastique Tiara, Rosé, Vanessa Vanjie, en Yvie Oddly op reis door iconische momenten in de geschiedenis in de hoop dat ze hun weg naar het heden terug kunnen vinden. 
De eerder aangekondigde show is verplaatst naar 16 mei 2022. Kaartkopers ontvangen een e-mail van Ticketmaster met meer informatie.",2021-05-17 11:00:00
48,afaslive,28,0,2021-04-26 09:42:55,"De kaartverkoop van de gloednieuwe show van @freekvonk gingen zo hard dat er afgelopen weekend nog twee shows zijn toegevoegd. Op dinsdag 28 december in #AFASLive om 13:30 uur en 17:00 uur. Ben jij erbij?🐍🐆🦅
Check meer info op www.afaslive.nl",2021-12-28 13:30:00
49,afaslive,31,2,2021-04-23 09:47:57,@freekvonk geeft na een lange stilte op 28 december 2021 een nieuwe live show in #AFASLive🐍🐆🦅 Onder de titel ‘Rovers In De Rimboe’ vertelt Freek in een spectaculair decor over zijn avonturen en ontdekkingen in het dierenrijk. Kaarten voor de show in de kerstvakantie gaan vandaag om 14:00 uur in de verkoop! Meer info via www.afaslive.nl,2021-12-28 14:00:00
50,afaslive,24,1,2021-04-12 20:11:54,"#Frenna komt naar #AFASLive!🔥 De Nederlandse zanger en rapper geeft op zaterdag 4 december in AFAS Live zijn grootste show tot nu toe. Gewapend met zijn nieuwste album ‘Highest’ en zijn 777 band komt hij de Amsterdamse zaal op zijn kop zetten. De kaartverkoop start dinsdag 20 april om 10.00 uur.

Meer info via www.afaslive.nl",2021-04-20 10:00:00
51,afaslive,32,0,2021-03-24 18:31:34,"✨✨✨Op zaterdag 1 oktober 2022 speelt de Amerikaanse rapper @russ een show in #AFASLive. De show is onderdeel van zijn Shake The Globe Tour. De kaartverkoop voor de show start aanstaande vrijdag 26 maart om 18:00 uur via Ticketmaster.

Meer info op www.afaslive.nl",2021-03-26 18:00:00
52,afaslive,24,0,2021-02-08 17:18:13,"Wegens de coronamaatregelen is X-Qlusive Phuture Noize dat gepland stond op 8 mei 2021 in #AFASLive verplaatst naar 29 januari 2022.

Tickets blijven geldig voor de nieuwe datum! Nog geen ticket? De tickets voor X-Qlusive Phuture Noize gaan weer in de verkoop op 6 maart 2021 - 13:00 uur CET.",2021-01-29 13:00:00
53,afaslive,44,0,2021-02-01 10:00:16,"Dance for me oh oh oh🎶 De Australische zangeres Tones And I geeft op dinsdag 19 oktober een concert in #AFASLive. 

In 2019 breekt ze door met de debuutsingle Johnny Run Away. Met haar tweede release Dance Monkey weet ze in meer dan 30 landen de nummer 1 positie van de hitlijsten te domineren!

De voorverkoop voor @tonesandi start woensdag 3 februari om 10.00 uur via Ticketmaster. Ga voor meer info naar www.afaslive.nl",2021-10-19 10:00:00
54,afaslive,60,9,2021-01-25 12:12:20,"EXTRA SHOW! @k3.studio100 wil al hun fans de kans geven om naar de 'Dromentour' te komen🌈 Daarom komt er in #AFASLive een extra show! Op zaterdag 10 juli om 16:00 uur. Ben jij erbij?

Ga naar www.afaslive.nl voor meer info.",2021-07-10 16:00:00
55,afaslive,31,3,2020-11-23 10:02:30,"#POWERWOLF komt op zondag 10 oktober 2021 naar #AFASLive!

Wolven zijn inmiddels weer een vaste waarde in de Nederlandse natuur en ook in de metal! Het Duitse Powerwolf stond al eerder op festivals als Dynamo Metalfest en als headliner op Into The Grave. Nu is Amsterdam aan de beurt om met huid en haar verslonden te worden. Dat wordt een bloederig mooi nieuw hoofdstuk in de opmars van deze wolf!

De epische powermetal met vlijmscherpe riffs en pakkende refreinen zal zeker ook weer op de nieuwe plaat te horen zijn, die ook helemaal in Nederland is opgenomen en in de zomer van 2021 verschijnt. 

De voorverkoop start woensdag 25 november 2020 om 10.00 uur via Ticketmaster. 

Meer info via www.afaslive.nl",2020-10-10 10:00:00
56,afaslive,85,4,2020-10-30 09:00:03,Op zondag 24 oktober 2021 brengt rocksensatie @yungblud de Life On Mars Tour naar #AFASLive! De kaartverkoop start straks om 10.00 uur. Zit je al klaar?? Meer info op www.afaslive.nl,2020-10-24 10:00:00
